{
  "name": "canopy",
  "displayName": "ðŸŒŸ Canopy",
  "description": "Modern React Native design system with balanced color palette and comfortable spacing - perfect for professional apps",
  "author": "RNCanopy Team",
  "version": "1.0.0",
  "personality": {
    "mood": "professional",
    "spacing": "comfortable", 
    "roundness": "rounded",
    "elevation": "soft"
  },
  "tokens": {
    "colors": {
      "light": {
        "primary": "#2a5dff",
        "primaryForeground": "#ffffff",
        "secondary": "#64748b",
        "secondaryForeground": "#ffffff",
        "background": "#fefefe",
        "foreground": "#1a1a1a",
        "card": "#ffffff",
        "cardForeground": "#1a1a1a",
        "muted": "#f1f5f9",
        "mutedForeground": "#64748b",
        "accent": "#f1f5f9",
        "accentForeground": "#1a1a1a",
        "destructive": "#ef4444",
        "destructiveForeground": "#ffffff",
        "border": "#e2e8f0",
        "input": "#e2e8f0",
        "ring": "#2a5dff",
        "success": "#22c55e",
        "successForeground": "#ffffff",
        "warning": "#f59e0b",
        "warningForeground": "#1a1a1a",
        "info": "#0ea5e9",
        "infoForeground": "#ffffff"
      },
      "dark": {
        "primary": "#3b7fff",
        "primaryForeground": "#ffffff",
        "secondary": "#475569",
        "secondaryForeground": "#ffffff",
        "background": "#0a0a0a",
        "foreground": "#fafafa",
        "card": "#1a1a1a",
        "cardForeground": "#fafafa",
        "muted": "#1a1a1a",
        "mutedForeground": "#a1a1aa",
        "accent": "#1a1a1a",
        "accentForeground": "#fafafa",
        "destructive": "#f87171",
        "destructiveForeground": "#ffffff",
        "border": "#27272a",
        "input": "#27272a",
        "ring": "#3b7fff",
        "success": "#4ade80",
        "successForeground": "#ffffff",
        "warning": "#facc15",
        "warningForeground": "#1a1a1a",
        "info": "#38bdf8",
        "infoForeground": "#ffffff"
      },
      "gradients": {
        "primary": {
          "default": ["#2a5dff", "#1d4ed8"],
          "subtle": ["#eff6ff", "#dbeafe"],
          "vibrant": ["#60a5fa", "#1e40af"]
        },
        "secondary": {
          "default": ["#64748b", "#475569"],
          "subtle": ["#f8fafc", "#e2e8f0"],
          "vibrant": ["#94a3b8", "#334155"]
        },
        "accent": {
          "default": ["#8b5cf6", "#7c3aed"],
          "subtle": ["#faf5ff", "#f3e8ff"],
          "vibrant": ["#a855f7", "#6b21a8"]
        }
      },
      "shades": {
        "primary": {
          "50": "#eff6ff",
          "100": "#dbeafe",
          "200": "#bfdbfe",
          "300": "#93c5fd",
          "400": "#60a5fa",
          "500": "#2a5dff",
          "600": "#1d4ed8",
          "700": "#1e40af",
          "800": "#1e3a8a",
          "900": "#1e3a8a"
        },
        "secondary": {
          "50": "#f8fafc",
          "100": "#f1f5f9",
          "200": "#e2e8f0",
          "300": "#cbd5e1",
          "400": "#94a3b8",
          "500": "#64748b",
          "600": "#475569",
          "700": "#334155",
          "800": "#1e293b",
          "900": "#0f172a"
        }
      }
    },
    "radii": {
      "none": 0,
      "xs": 4,
      "sm": 8,
      "md": 12,
      "lg": 16,
      "xl": 24,
      "2xl": 32,
      "3xl": 48,
      "full": 9999
    },
    "spacing": {
      "0": 0,
      "0.5": 2,
      "1": 4,
      "1.5": 6,
      "2": 8,
      "2.5": 10,
      "3": 12,
      "3.5": 14,
      "4": 16,
      "5": 20,
      "6": 24,
      "7": 28,
      "8": 32,
      "9": 36,
      "10": 40,
      "12": 48,
      "16": 64,
      "20": 80,
      "24": 96,
      "32": 128,
      "40": 160,
      "48": 192,
      "56": 224,
      "64": 256
    },
    "typography": {
      "fonts": {
        "sans": "System",
        "serif": "Georgia",
        "mono": "Menlo",
        "heading": "System",
        "body": "System"
      },
      "fontSizes": {
        "xs": 12,
        "sm": 14,
        "md": 16,
        "lg": 18,
        "xl": 20,
        "2xl": 24,
        "3xl": 30,
        "4xl": 36,
        "5xl": 48,
        "6xl": 60
      },
      "fontWeights": {
        "thin": "100",
        "extraLight": "200",
        "light": "300",
        "normal": "400",
        "medium": "500",
        "semiBold": "600",
        "bold": "700",
        "extraBold": "800",
        "black": "900"
      },
      "lineHeights": {
        "tight": 1.25,
        "snug": 1.375,
        "normal": 1.5,
        "relaxed": 1.625,
        "loose": 2
      },
      "letterSpacings": {
        "tighter": -0.5,
        "tight": -0.25,
        "normal": 0,
        "wide": 0.25,
        "wider": 0.5,
        "widest": 1
      }
    },
    "shadows": {
      "none": "none",
      "xs": "0px 1px 2px rgba(0, 0, 0, 0.05)",
      "sm": "0px 1px 3px rgba(0, 0, 0, 0.1)",
      "md": "0px 4px 6px rgba(0, 0, 0, 0.1)",
      "lg": "0px 10px 15px rgba(0, 0, 0, 0.1)",
      "xl": "0px 20px 25px rgba(0, 0, 0, 0.1)",
      "2xl": "0px 25px 50px rgba(0, 0, 0, 0.25)",
      "inner": "inset 0px 2px 4px rgba(0, 0, 0, 0.06)"
    },
    "borders": {
      "widths": {
        "none": 0,
        "hairline": 0.5,
        "thin": 1,
        "normal": 1.5,
        "thick": 2,
        "extraThick": 4
      },
      "styles": {
        "solid": "solid",
        "dashed": "dashed",
        "dotted": "dotted"
      }
    },
    "sizes": {
      "none": 0,
      "xs": 20,
      "sm": 28,
      "md": 36,
      "lg": 44,
      "xl": 52,
      "2xl": 60,
      "3xl": 72,
      "4xl": 88,
      "5xl": 104,
      "full": "100%"
    },
    "durations": {
      "instant": 0,
      "fast": 200,
      "normal": 300,
      "slow": 500,
      "slower": 750
    },
    "easings": {
      "linear": "linear",
      "ease": "ease",
      "easeIn": "ease-in",
      "easeOut": "ease-out",
      "easeInOut": "ease-in-out",
      "spring": "cubic-bezier(0.68, -0.55, 0.265, 1.55)",
      "smooth": "cubic-bezier(0.4, 0, 0.2, 1)"
    },
    "opacity": {
      "invisible": 0,
      "low": 0.25,
      "disabled": 0.4,
      "muted": 0.6,
      "high": 0.8,
      "overlay": 0.9,
      "visible": 1
    }
  },
  "preview": {
    "primary": "#2a5dff",
    "secondary": "#64748b",
    "background": "#fefefe",
    "surface": "#ffffff",
    "borderRadius": 12,
    "shadowIntensity": "medium"
  }
}