{
  "name": "dusk",
  "displayName": "ðŸŒ™ Dusk",
  "description": "Dark, moody palette with dramatic shadows - perfect for entertainment and gaming apps",
  "author": "RNCanopy Team",
  "version": "1.0.0",
  "personality": {
    "mood": "dramatic",
    "spacing": "comfortable",
    "roundness": "rounded",
    "elevation": "dramatic"
  },
  "tokens": {
    "colors": {
      "light": {
        "primary": "#a855f7",
        "primaryForeground": "#ffffff",
        "secondary": "#64748b",
        "secondaryForeground": "#ffffff",
        "background": "#1a1b23",
        "foreground": "#e4e4e7",
        "card": "#2d2e36",
        "cardForeground": "#e4e4e7",
        "muted": "#2d2e36",
        "mutedForeground": "#9ca3af",
        "accent": "#f59e0b",
        "accentForeground": "#1a1b23",
        "destructive": "#f87171",
        "destructiveForeground": "#1a1b23",
        "border": "#3c3d45",
        "input": "#2d2e36",
        "ring": "#a855f7",
        "success": "#4ade80",
        "successForeground": "#1a1b23",
        "warning": "#facc15",
        "warningForeground": "#1a1b23",
        "info": "#38bdf8",
        "infoForeground": "#1a1b23"
      },
      "dark": {
        "primary": "#a855f7",
        "primaryForeground": "#ffffff",
        "secondary": "#52525b",
        "secondaryForeground": "#ffffff",
        "background": "#0a0b0f",
        "foreground": "#f4f4f5",
        "card": "#1a1b23",
        "cardForeground": "#f4f4f5",
        "muted": "#1a1b23",
        "mutedForeground": "#a1a1aa",
        "accent": "#f59e0b",
        "accentForeground": "#0a0b0f",
        "destructive": "#f87171",
        "destructiveForeground": "#0a0b0f",
        "border": "#27272a",
        "input": "#1a1b23",
        "ring": "#a855f7",
        "success": "#4ade80",
        "successForeground": "#0a0b0f",
        "warning": "#facc15",
        "warningForeground": "#0a0b0f",
        "info": "#38bdf8",
        "infoForeground": "#0a0b0f"
      },
      "gradients": {
        "primary": {
          "default": ["#a855f7", "#7c3aed"],
          "subtle": ["#faf5ff", "#f3e8ff"],
          "vibrant": ["#c084fc", "#6b21a8"]
        },
        "secondary": {
          "default": ["#64748b", "#475569"],
          "subtle": ["#18181b", "#27272a"],
          "vibrant": ["#71717a", "#3f3f46"]
        },
        "accent": {
          "default": ["#f59e0b", "#d97706"],
          "subtle": ["#fffbeb", "#fef3c7"],
          "vibrant": ["#fbbf24", "#b45309"]
        }
      },
      "shades": {
        "primary": {
          "50": "#faf5ff",
          "100": "#f3e8ff",
          "200": "#e9d5ff",
          "300": "#d8b4fe",
          "400": "#c084fc",
          "500": "#a855f7",
          "600": "#9333ea",
          "700": "#7e22ce",
          "800": "#6b21a8",
          "900": "#581c87"
        },
        "secondary": {
          "50": "#fafafa",
          "100": "#f4f4f5",
          "200": "#e4e4e7",
          "300": "#d4d4d8",
          "400": "#a1a1aa",
          "500": "#71717a",
          "600": "#52525b",
          "700": "#3f3f46",
          "800": "#27272a",
          "900": "#18181b"
        }
      }
    },
    "radii": {
      "none": 0,
      "xs": 6,
      "sm": 10,
      "md": 14,
      "lg": 18,
      "xl": 26,
      "2xl": 34,
      "3xl": 50,
      "full": 9999
    },
    "spacing": {
      "0": 0,
      "0.5": 2,
      "1": 4,
      "1.5": 6,
      "2": 8,
      "2.5": 10,
      "3": 12,
      "3.5": 14,
      "4": 16,
      "5": 20,
      "6": 24,
      "7": 28,
      "8": 32,
      "9": 36,
      "10": 40,
      "12": 48,
      "16": 64,
      "20": 80,
      "24": 96,
      "32": 128,
      "40": 160,
      "48": 192,
      "56": 224,
      "64": 256
    },
    "typography": {
      "fonts": {
        "sans": "System",
        "serif": "Georgia",
        "mono": "Menlo",
        "heading": "System",
        "body": "System"
      },
      "fontSizes": {
        "xs": 11,
        "sm": 13,
        "md": 15,
        "lg": 17,
        "xl": 19,
        "2xl": 23,
        "3xl": 29,
        "4xl": 35,
        "5xl": 47,
        "6xl": 59
      },
      "fontWeights": {
        "thin": "100",
        "extraLight": "200",
        "light": "300",
        "normal": "400",
        "medium": "500",
        "semiBold": "600",
        "bold": "700",
        "extraBold": "800",
        "black": "900"
      },
      "lineHeights": {
        "tight": 1.2,
        "snug": 1.3,
        "normal": 1.45,
        "relaxed": 1.6,
        "loose": 1.9
      },
      "letterSpacings": {
        "tighter": -0.8,
        "tight": -0.4,
        "normal": 0,
        "wide": 0.3,
        "wider": 0.6,
        "widest": 1.2
      }
    },
    "shadows": {
      "none": "none",
      "xs": "0px 2px 4px rgba(0, 0, 0, 0.15)",
      "sm": "0px 4px 8px rgba(0, 0, 0, 0.25)",
      "md": "0px 8px 16px rgba(0, 0, 0, 0.35)",
      "lg": "0px 16px 32px rgba(0, 0, 0, 0.45)",
      "xl": "0px 24px 48px rgba(0, 0, 0, 0.55)",
      "2xl": "0px 32px 64px rgba(0, 0, 0, 0.65)",
      "inner": "inset 0px 4px 8px rgba(0, 0, 0, 0.25)"
    },
    "borders": {
      "widths": {
        "none": 0,
        "hairline": 0.5,
        "thin": 1,
        "normal": 2,
        "thick": 3,
        "extraThick": 4
      },
      "styles": {
        "solid": "solid",
        "dashed": "dashed",
        "dotted": "dotted"
      }
    },
    "sizes": {
      "none": 0,
      "xs": 18,
      "sm": 26,
      "md": 34,
      "lg": 42,
      "xl": 50,
      "2xl": 58,
      "3xl": 70,
      "4xl": 86,
      "5xl": 102,
      "full": "100%"
    },
    "durations": {
      "instant": 0,
      "fast": 150,
      "normal": 250,
      "slow": 400,
      "slower": 600
    },
    "easings": {
      "linear": "linear",
      "ease": "ease",
      "easeIn": "ease-in",
      "easeOut": "ease-out",
      "easeInOut": "ease-in-out",
      "spring": "cubic-bezier(0.68, -0.55, 0.265, 1.55)",
      "smooth": "cubic-bezier(0.4, 0, 0.2, 1)"
    },
    "opacity": {
      "invisible": 0,
      "low": 0.2,
      "disabled": 0.35,
      "muted": 0.55,
      "high": 0.75,
      "overlay": 0.85,
      "visible": 1
    }
  },
  "preview": {
    "primary": "#a855f7",
    "secondary": "#64748b",
    "background": "#1a1b23",
    "surface": "#2d2e36",
    "borderRadius": 14,
    "shadowIntensity": "heavy"
  }
}