{
  "name": "sunbeam",
  "displayName": "☀️ Sunbeam",
  "description": "Warm, light-friendly UI with organic curves and spacious layout - perfect for wellness and lifestyle apps",
  "author": "RNCanopy Team",
  "version": "1.0.0",
  "personality": {
    "mood": "warm",
    "spacing": "spacious",
    "roundness": "organic",
    "elevation": "soft"
  },
  "tokens": {
    "colors": {
      "light": {
        "primary": "#f59e0b",
        "primaryForeground": "#ffffff",
        "secondary": "#84cc16",
        "secondaryForeground": "#ffffff",
        "background": "#fffef7",
        "foreground": "#292524",
        "card": "#fefce8",
        "cardForeground": "#292524",
        "muted": "#fef3c7",
        "mutedForeground": "#78716c",
        "accent": "#fed7aa",
        "accentForeground": "#292524",
        "destructive": "#dc2626",
        "destructiveForeground": "#ffffff",
        "border": "#fde68a",
        "input": "#fef3c7",
        "ring": "#f59e0b",
        "success": "#16a34a",
        "successForeground": "#ffffff",
        "warning": "#ea580c",
        "warningForeground": "#ffffff",
        "info": "#0284c7",
        "infoForeground": "#ffffff"
      },
      "dark": {
        "primary": "#fbbf24",
        "primaryForeground": "#451a03",
        "secondary": "#a3e635",
        "secondaryForeground": "#1a2e05",
        "background": "#1c1917",
        "foreground": "#fafaf9",
        "card": "#292524",
        "cardForeground": "#fafaf9",
        "muted": "#44403c",
        "mutedForeground": "#a8a29e",
        "accent": "#78716c",
        "accentForeground": "#fafaf9",
        "destructive": "#ef4444",
        "destructiveForeground": "#ffffff",
        "border": "#57534e",
        "input": "#44403c",
        "ring": "#fbbf24",
        "success": "#22c55e",
        "successForeground": "#ffffff",
        "warning": "#fb923c",
        "warningForeground": "#451a03",
        "info": "#0ea5e9",
        "infoForeground": "#ffffff"
      },
      "gradients": {
        "primary": {
          "default": ["#f59e0b", "#d97706"],
          "subtle": ["#fffbeb", "#fef3c7"],
          "vibrant": ["#fbbf24", "#b45309"]
        },
        "secondary": {
          "default": ["#84cc16", "#65a30d"],
          "subtle": ["#f7fee7", "#ecfccb"],
          "vibrant": ["#a3e635", "#4d7c0f"]
        },
        "accent": {
          "default": ["#fb923c", "#ea580c"],
          "subtle": ["#fff7ed", "#fed7aa"],
          "vibrant": ["#fd7c2b", "#c2410c"]
        }
      },
      "shades": {
        "primary": {
          "50": "#fffbeb",
          "100": "#fef3c7",
          "200": "#fde68a",
          "300": "#fcd34d",
          "400": "#fbbf24",
          "500": "#f59e0b",
          "600": "#d97706",
          "700": "#b45309",
          "800": "#92400e",
          "900": "#78350f"
        },
        "secondary": {
          "50": "#f7fee7",
          "100": "#ecfccb",
          "200": "#d9f99d",
          "300": "#bef264",
          "400": "#a3e635",
          "500": "#84cc16",
          "600": "#65a30d",
          "700": "#4d7c0f",
          "800": "#365314",
          "900": "#1a2e05"
        }
      }
    },
    "radii": {
      "none": 0,
      "xs": 8,
      "sm": 16,
      "md": 24,
      "lg": 32,
      "xl": 48,
      "2xl": 64,
      "3xl": 96,
      "full": 9999
    },
    "spacing": {
      "0": 0,
      "0.5": 3,
      "1": 6,
      "1.5": 9,
      "2": 12,
      "2.5": 15,
      "3": 18,
      "3.5": 21,
      "4": 24,
      "5": 30,
      "6": 36,
      "7": 42,
      "8": 48,
      "9": 54,
      "10": 60,
      "12": 72,
      "16": 96,
      "20": 120,
      "24": 144,
      "32": 192,
      "40": 240,
      "48": 288,
      "56": 336,
      "64": 384
    },
    "typography": {
      "fonts": {
        "sans": "System",
        "serif": "Georgia",
        "mono": "Menlo",
        "heading": "System",
        "body": "System"
      },
      "fontSizes": {
        "xs": 14,
        "sm": 16,
        "md": 18,
        "lg": 20,
        "xl": 22,
        "2xl": 26,
        "3xl": 32,
        "4xl": 38,
        "5xl": 50,
        "6xl": 62
      },
      "fontWeights": {
        "thin": "100",
        "extraLight": "200",
        "light": "300",
        "normal": "400",
        "medium": "500",
        "semiBold": "600",
        "bold": "700",
        "extraBold": "800",
        "black": "900"
      },
      "lineHeights": {
        "tight": 1.3,
        "snug": 1.45,
        "normal": 1.6,
        "relaxed": 1.75,
        "loose": 2.1
      },
      "letterSpacings": {
        "tighter": -0.3,
        "tight": -0.15,
        "normal": 0,
        "wide": 0.3,
        "wider": 0.6,
        "widest": 1.5
      }
    },
    "shadows": {
      "none": "none",
      "xs": "0px 1px 3px rgba(251, 146, 60, 0.1)",
      "sm": "0px 2px 6px rgba(251, 146, 60, 0.15)",
      "md": "0px 4px 12px rgba(251, 146, 60, 0.2)",
      "lg": "0px 8px 24px rgba(251, 146, 60, 0.25)",
      "xl": "0px 16px 48px rgba(251, 146, 60, 0.3)",
      "2xl": "0px 24px 64px rgba(251, 146, 60, 0.35)",
      "inner": "inset 0px 2px 6px rgba(251, 146, 60, 0.1)"
    },
    "borders": {
      "widths": {
        "none": 0,
        "hairline": 0.5,
        "thin": 1,
        "normal": 1.5,
        "thick": 2.5,
        "extraThick": 4
      },
      "styles": {
        "solid": "solid",
        "dashed": "dashed",
        "dotted": "dotted"
      }
    },
    "sizes": {
      "none": 0,
      "xs": 24,
      "sm": 32,
      "md": 40,
      "lg": 48,
      "xl": 56,
      "2xl": 64,
      "3xl": 76,
      "4xl": 92,
      "5xl": 108,
      "full": "100%"
    },
    "durations": {
      "instant": 0,
      "fast": 250,
      "normal": 400,
      "slow": 600,
      "slower": 850
    },
    "easings": {
      "linear": "linear",
      "ease": "ease",
      "easeIn": "ease-in",
      "easeOut": "ease-out",
      "easeInOut": "ease-in-out",
      "spring": "cubic-bezier(0.68, -0.55, 0.265, 1.55)",
      "smooth": "cubic-bezier(0.4, 0, 0.2, 1)"
    },
    "opacity": {
      "invisible": 0,
      "low": 0.3,
      "disabled": 0.45,
      "muted": 0.65,
      "high": 0.85,
      "overlay": 0.95,
      "visible": 1
    }
  },
  "preview": {
    "primary": "#f59e0b",
    "secondary": "#84cc16",
    "background": "#fffef7",
    "surface": "#fefce8",
    "borderRadius": 24,
    "shadowIntensity": "light"
  }
}