{
  "name": "slate",
  "displayName": "üè¢ Slate",
  "description": "Neutral, professional tone with sharp edges and compact spacing - perfect for business and admin interfaces",
  "author": "RNCanopy Team",
  "version": "1.0.0",
  "personality": {
    "mood": "minimal",
    "spacing": "compact",
    "roundness": "sharp",
    "elevation": "flat"
  },
  "tokens": {
    "colors": {
      "light": {
        "primary": "#374151",
        "primaryForeground": "#ffffff",
        "secondary": "#6b7280",
        "secondaryForeground": "#ffffff",
        "background": "#ffffff",
        "foreground": "#111827",
        "card": "#f9fafb",
        "cardForeground": "#111827",
        "muted": "#f3f4f6",
        "mutedForeground": "#6b7280",
        "accent": "#f3f4f6",
        "accentForeground": "#111827",
        "destructive": "#dc2626",
        "destructiveForeground": "#ffffff",
        "border": "#d1d5db",
        "input": "#d1d5db",
        "ring": "#374151",
        "success": "#059669",
        "successForeground": "#ffffff",
        "warning": "#d97706",
        "warningForeground": "#ffffff",
        "info": "#0369a1",
        "infoForeground": "#ffffff"
      },
      "dark": {
        "primary": "#9ca3af",
        "primaryForeground": "#111827",
        "secondary": "#6b7280",
        "secondaryForeground": "#ffffff",
        "background": "#111827",
        "foreground": "#f9fafb",
        "card": "#1f2937",
        "cardForeground": "#f9fafb",
        "muted": "#374151",
        "mutedForeground": "#9ca3af",
        "accent": "#374151",
        "accentForeground": "#f9fafb",
        "destructive": "#ef4444",
        "destructiveForeground": "#ffffff",
        "border": "#4b5563",
        "input": "#374151",
        "ring": "#9ca3af",
        "success": "#10b981",
        "successForeground": "#ffffff",
        "warning": "#f59e0b",
        "warningForeground": "#111827",
        "info": "#0ea5e9",
        "infoForeground": "#ffffff"
      },
      "gradients": {
        "primary": {
          "default": ["#374151", "#1f2937"],
          "subtle": ["#f9fafb", "#f3f4f6"],
          "vibrant": ["#4b5563", "#111827"]
        },
        "secondary": {
          "default": ["#6b7280", "#4b5563"],
          "subtle": ["#f3f4f6", "#e5e7eb"],
          "vibrant": ["#9ca3af", "#374151"]
        },
        "accent": {
          "default": ["#e5e7eb", "#d1d5db"],
          "subtle": ["#ffffff", "#f9fafb"],
          "vibrant": ["#d1d5db", "#9ca3af"]
        }
      },
      "shades": {
        "primary": {
          "50": "#f9fafb",
          "100": "#f3f4f6",
          "200": "#e5e7eb",
          "300": "#d1d5db",
          "400": "#9ca3af",
          "500": "#6b7280",
          "600": "#4b5563",
          "700": "#374151",
          "800": "#1f2937",
          "900": "#111827"
        },
        "secondary": {
          "50": "#f8fafc",
          "100": "#f1f5f9",
          "200": "#e2e8f0",
          "300": "#cbd5e1",
          "400": "#94a3b8",
          "500": "#64748b",
          "600": "#475569",
          "700": "#334155",
          "800": "#1e293b",
          "900": "#0f172a"
        }
      }
    },
    "radii": {
      "none": 0,
      "xs": 2,
      "sm": 4,
      "md": 6,
      "lg": 8,
      "xl": 12,
      "2xl": 16,
      "3xl": 24,
      "full": 9999
    },
    "spacing": {
      "0": 0,
      "0.5": 1,
      "1": 2,
      "1.5": 3,
      "2": 4,
      "2.5": 5,
      "3": 6,
      "3.5": 7,
      "4": 8,
      "5": 10,
      "6": 12,
      "7": 14,
      "8": 16,
      "9": 18,
      "10": 20,
      "12": 24,
      "16": 32,
      "20": 40,
      "24": 48,
      "32": 64,
      "40": 80,
      "48": 96,
      "56": 112,
      "64": 128
    },
    "typography": {
      "fonts": {
        "sans": "System",
        "serif": "Georgia",
        "mono": "Menlo",
        "heading": "System",
        "body": "System"
      },
      "fontSizes": {
        "xs": 11,
        "sm": 12,
        "md": 14,
        "lg": 16,
        "xl": 18,
        "2xl": 20,
        "3xl": 24,
        "4xl": 28,
        "5xl": 36,
        "6xl": 48
      },
      "fontWeights": {
        "thin": "100",
        "extraLight": "200",
        "light": "300",
        "normal": "400",
        "medium": "500",
        "semiBold": "600",
        "bold": "700",
        "extraBold": "800",
        "black": "900"
      },
      "lineHeights": {
        "tight": 1.2,
        "snug": 1.3,
        "normal": 1.4,
        "relaxed": 1.5,
        "loose": 1.8
      },
      "letterSpacings": {
        "tighter": -0.25,
        "tight": -0.1,
        "normal": 0,
        "wide": 0.1,
        "wider": 0.25,
        "widest": 0.5
      }
    },
    "shadows": {
      "none": "none",
      "xs": "0px 1px 1px rgba(0, 0, 0, 0.05)",
      "sm": "0px 1px 2px rgba(0, 0, 0, 0.08)",
      "md": "0px 2px 4px rgba(0, 0, 0, 0.1)",
      "lg": "0px 4px 8px rgba(0, 0, 0, 0.12)",
      "xl": "0px 8px 16px rgba(0, 0, 0, 0.15)",
      "2xl": "0px 12px 24px rgba(0, 0, 0, 0.18)",
      "inner": "inset 0px 1px 2px rgba(0, 0, 0, 0.05)"
    },
    "borders": {
      "widths": {
        "none": 0,
        "hairline": 0.5,
        "thin": 1,
        "normal": 1,
        "thick": 2,
        "extraThick": 3
      },
      "styles": {
        "solid": "solid",
        "dashed": "dashed",
        "dotted": "dotted"
      }
    },
    "sizes": {
      "none": 0,
      "xs": 16,
      "sm": 20,
      "md": 24,
      "lg": 28,
      "xl": 32,
      "2xl": 36,
      "3xl": 40,
      "4xl": 48,
      "5xl": 56,
      "full": "100%"
    },
    "durations": {
      "instant": 0,
      "fast": 150,
      "normal": 200,
      "slow": 300,
      "slower": 450
    },
    "easings": {
      "linear": "linear",
      "ease": "ease",
      "easeIn": "ease-in",
      "easeOut": "ease-out",
      "easeInOut": "ease-in-out",
      "spring": "cubic-bezier(0.68, -0.55, 0.265, 1.55)",
      "smooth": "cubic-bezier(0.4, 0, 0.2, 1)"
    },
    "opacity": {
      "invisible": 0,
      "low": 0.2,
      "disabled": 0.3,
      "muted": 0.5,
      "high": 0.7,
      "overlay": 0.8,
      "visible": 1
    }
  },
  "preview": {
    "primary": "#374151",
    "secondary": "#6b7280",
    "background": "#ffffff",
    "surface": "#f9fafb",
    "borderRadius": 6,
    "shadowIntensity": "none"
  }
}